### ISSUE TITLE
RTSP Sink模块 推理后，通过vlc 拉流，抓发现SDP 中缺少视频分辨率、PPS_SPS编码，导致web端播放失败？

### ISSUE THREAD

**Issue by kingsenye** [Cambricon/CNStream#189]
Frame 1291: 560 bytes on wire (4480 bits), 560 bytes captured (4480 bits) on interface \Device\NPF_{320CB933-B7B3-4AAA-96B8-D3480C145D2E}, id 0
Ethernet II, Src: fe:3a:94:60:42:d1 (fe:3a:94:60:42:d1), Dst: IntelCor_bb:06:e3 (14:ab:c5:bb:06:e3)
Internet Protocol Version 4, Src: 192.168.8.217, Dst: 192.168.8.180
Transmission Control Protocol, Src Port: 9554, Dst Port: 55810, Seq: 153, Ack: 245, Len: 506
Real Time Streaming Protocol
    Response: RTSP/1.0 200 OK\r\n
    CSeq: 3\r\n
    Date: Thu, Jan 01 1970 19:31:28 GMT\r\n
    Content-Base: rtsp://192.168.8.217:9554/live/\r\n
    Content-type: application/sdp
    Content-length: 342
    \r\n
    Session Description Protocol
        Session Description Protocol Version (v): 0
        Owner/Creator, Session Id (o): - 70280119922 1 IN IP4 192.168.8.217
        Session Name (s): RTSP Live Streaming Session
        Session Information (i): live
        Time Description, active time (t): 0 0
        Session Attribute (a): tool:LIVE555 Streaming Media v2020.10.16
        Session Attribute (a): type:broadcast
        Session Attribute (a): control:*
        Session Attribute (a): range:npt=0-
        Session Attribute (a): x-qt-text-nam:RTSP Live Streaming Session
        Session Attribute (a): x-qt-text-inf:live
        Media Description, name and address (m): video 0 RTP/AVP 96
        Connection Information (c): IN IP4 0.0.0.0
        Bandwidth Information (b): AS:3906
        Media Attribute (a): rtpmap:96 H264/90000
        Media Attribute (a): control:track1

各位老大是否有碰到过 web 端播放RTSP Sink模块 推理后的rtsp流失败问题？
